{
  "$schema": "https://json-schema.org/draft/2020-12/schema",
  "$id": "https://andarilho.dev/schemas/layout/1.0.json",
  "x-schema-version": "1.0",
  "$defs": {
    "Landmark": {
      "additionalProperties": false,
      "properties": {
        "id": {
          "pattern": "^[A-Za-z0-9][A-Za-z0-9_-]{0,127}$",
          "title": "Id",
          "type": "string"
        },
        "planPoint": {
          "anyOf": [
            {
              "items": {
                "type": "number"
              },
              "maxItems": 2,
              "minItems": 2,
              "type": "array"
            },
            {
              "type": "null"
            }
          ],
          "default": null,
          "title": "Planpoint"
        },
        "worldPoint": {
          "items": {
            "type": "number"
          },
          "maxItems": 3,
          "minItems": 3,
          "title": "Worldpoint",
          "type": "array"
        },
        "uncertainty": {
          "default": 0.0,
          "minimum": 0,
          "title": "Uncertainty",
          "type": "number"
        }
      },
      "required": [
        "id",
        "worldPoint"
      ],
      "title": "Landmark",
      "type": "object"
    },
    "LayoutFloor": {
      "additionalProperties": false,
      "properties": {
        "id": {
          "pattern": "^[A-Za-z0-9][A-Za-z0-9_-]{0,127}$",
          "title": "Id",
          "type": "string"
        },
        "elevation": {
          "title": "Elevation",
          "type": "number"
        },
        "polygons": {
          "items": {
            "items": {
              "items": {
                "type": "number"
              },
              "maxItems": 2,
              "minItems": 2,
              "type": "array"
            },
            "maxItems": 512,
            "minItems": 3,
            "type": "array"
          },
          "maxItems": 64,
          "minItems": 1,
          "title": "Polygons",
          "type": "array"
        },
        "holes": {
          "items": {
            "items": {
              "items": {
                "type": "number"
              },
              "maxItems": 2,
              "minItems": 2,
              "type": "array"
            },
            "maxItems": 512,
            "minItems": 3,
            "type": "array"
          },
          "maxItems": 64,
          "title": "Holes",
          "type": "array"
        }
      },
      "required": [
        "id",
        "elevation",
        "polygons"
      ],
      "title": "LayoutFloor",
      "type": "object"
    },
    "LayoutSpawn": {
      "additionalProperties": false,
      "properties": {
        "feet": {
          "items": {
            "type": "number"
          },
          "maxItems": 3,
          "minItems": 3,
          "title": "Feet",
          "type": "array"
        },
        "yawRadians": {
          "title": "Yawradians",
          "type": "number"
        },
        "floorId": {
          "pattern": "^[A-Za-z0-9][A-Za-z0-9_-]{0,127}$",
          "title": "Floorid",
          "type": "string"
        }
      },
      "required": [
        "feet",
        "yawRadians",
        "floorId"
      ],
      "title": "LayoutSpawn",
      "type": "object"
    },
    "Obstacle": {
      "additionalProperties": false,
      "properties": {
        "confidence": {
          "default": 1.0,
          "maximum": 1,
          "minimum": 0,
          "title": "Confidence",
          "type": "number"
        },
        "provenance": {
          "default": "user",
          "enum": [
            "user",
            "floor_plan",
            "proposal",
            "synthetic"
          ],
          "title": "Provenance",
          "type": "string"
        },
        "id": {
          "pattern": "^[A-Za-z0-9][A-Za-z0-9_-]{0,127}$",
          "title": "Id",
          "type": "string"
        },
        "floorId": {
          "pattern": "^[A-Za-z0-9][A-Za-z0-9_-]{0,127}$",
          "title": "Floorid",
          "type": "string"
        },
        "footprint": {
          "items": {
            "items": {
              "type": "number"
            },
            "maxItems": 2,
            "minItems": 2,
            "type": "array"
          },
          "maxItems": 512,
          "minItems": 3,
          "title": "Footprint",
          "type": "array"
        },
        "height": {
          "exclusiveMinimum": 0,
          "title": "Height",
          "type": "number"
        }
      },
      "required": [
        "id",
        "floorId",
        "footprint",
        "height"
      ],
      "title": "Obstacle",
      "type": "object"
    },
    "Opening": {
      "additionalProperties": false,
      "properties": {
        "confidence": {
          "default": 1.0,
          "maximum": 1,
          "minimum": 0,
          "title": "Confidence",
          "type": "number"
        },
        "provenance": {
          "default": "user",
          "enum": [
            "user",
            "floor_plan",
            "proposal",
            "synthetic"
          ],
          "title": "Provenance",
          "type": "string"
        },
        "id": {
          "pattern": "^[A-Za-z0-9][A-Za-z0-9_-]{0,127}$",
          "title": "Id",
          "type": "string"
        },
        "wallId": {
          "pattern": "^[A-Za-z0-9][A-Za-z0-9_-]{0,127}$",
          "title": "Wallid",
          "type": "string"
        },
        "offset": {
          "minimum": 0,
          "title": "Offset",
          "type": "number"
        },
        "width": {
          "exclusiveMinimum": 0,
          "title": "Width",
          "type": "number"
        },
        "bottom": {
          "default": 0.0,
          "minimum": 0,
          "title": "Bottom",
          "type": "number"
        },
        "top": {
          "exclusiveMinimum": 0,
          "title": "Top",
          "type": "number"
        },
        "state": {
          "default": "open",
          "enum": [
            "open",
            "closed"
          ],
          "title": "State",
          "type": "string"
        }
      },
      "required": [
        "id",
        "wallId",
        "offset",
        "width",
        "top"
      ],
      "title": "Opening",
      "type": "object"
    },
    "Wall": {
      "additionalProperties": false,
      "properties": {
        "confidence": {
          "default": 1.0,
          "maximum": 1,
          "minimum": 0,
          "title": "Confidence",
          "type": "number"
        },
        "provenance": {
          "default": "user",
          "enum": [
            "user",
            "floor_plan",
            "proposal",
            "synthetic"
          ],
          "title": "Provenance",
          "type": "string"
        },
        "id": {
          "pattern": "^[A-Za-z0-9][A-Za-z0-9_-]{0,127}$",
          "title": "Id",
          "type": "string"
        },
        "floorId": {
          "pattern": "^[A-Za-z0-9][A-Za-z0-9_-]{0,127}$",
          "title": "Floorid",
          "type": "string"
        },
        "start": {
          "items": {
            "type": "number"
          },
          "maxItems": 2,
          "minItems": 2,
          "title": "Start",
          "type": "array"
        },
        "end": {
          "items": {
            "type": "number"
          },
          "maxItems": 2,
          "minItems": 2,
          "title": "End",
          "type": "array"
        },
        "thickness": {
          "exclusiveMinimum": 0,
          "title": "Thickness",
          "type": "number"
        },
        "height": {
          "exclusiveMinimum": 0,
          "title": "Height",
          "type": "number"
        }
      },
      "required": [
        "id",
        "floorId",
        "start",
        "end",
        "thickness",
        "height"
      ],
      "title": "Wall",
      "type": "object"
    }
  },
  "additionalProperties": false,
  "properties": {
    "schemaVersion": {
      "const": "1.0",
      "title": "Schemaversion",
      "type": "string"
    },
    "floors": {
      "items": {
        "$ref": "#/$defs/LayoutFloor"
      },
      "maxItems": 16,
      "minItems": 1,
      "title": "Floors",
      "type": "array"
    },
    "walls": {
      "items": {
        "$ref": "#/$defs/Wall"
      },
      "maxItems": 2048,
      "title": "Walls",
      "type": "array"
    },
    "openings": {
      "items": {
        "$ref": "#/$defs/Opening"
      },
      "maxItems": 1024,
      "title": "Openings",
      "type": "array"
    },
    "obstacles": {
      "items": {
        "$ref": "#/$defs/Obstacle"
      },
      "maxItems": 1024,
      "title": "Obstacles",
      "type": "array"
    },
    "landmarks": {
      "items": {
        "$ref": "#/$defs/Landmark"
      },
      "maxItems": 256,
      "title": "Landmarks",
      "type": "array"
    },
    "spawn": {
      "$ref": "#/$defs/LayoutSpawn"
    }
  },
  "required": [
    "schemaVersion",
    "floors",
    "spawn"
  ],
  "title": "Layout",
  "type": "object"
}
